"Epic","Feature","Story","FAILED","BROKEN","PASSED","SKIPPED","UNKNOWN"
"","Temporary Worker Feature","Check If Export Button actually downloads the file and its in csv format","0","0","1","0","0"
"","Temporary Worker Feature","Delete First Temporary worker","0","1","0","0","0"
"","Users Feature","Check If Export Button actually downloads the file and its in csv format","0","0","1","0","0"
"","Users Feature","Check All Necessary Buttons Clickable","0","0","1","0","0"
"","Temporary Worker Feature","Delete Last Temporary worker","0","0","1","0","0"
"","Users Feature","Check All Necessary Buttons are Visible","0","0","1","0","0"
"","Temporary Worker Feature","Check All Necessary Buttons Clickable","0","0","1","0","0"
